smartctl 7.5 2025-04-30 r5714 [x86_64-linux-6.12.0] (local build)
Copyright (C) 2002-25, Bruce Allen, Christian Franke, www.smartmontools.org

=== START OF READ SMART DATA SECTION ===
SMART Attributes Data Structure revision number: 16
Vendor Specific SMART Attributes with Thresholds:
ID# ATTRIBUTE_NAME          FLAGS    VALUE WORST THRESH FAIL RAW_VALUE
  1 Raw_Read_Error_Rate     POSR-K   200   200   051    -    0
  3 Spin_Up_Time            POS--K   178   176   021    -    6083
  9 Power_On_Hours          -O--CK   033   033   000    -    59342h+32m+09.624s
 12 Power_Cycle_Count       -O--CK   100   100   000    -    0x00000000002f
190 Airflow_Temperature_Cel -O---K   069   052   040    -    31 (Min/Max 24/35)
194 Temperature_Celsius     -O---K   119   103   000    -    33
199 UDMA_CRC_Error_Count    -O--CK   200   200   000    -    unknown
240 Head_Flying_Hours       ------   100   253   000    -    41234h+10m+03.100s
241 Total_LBAs_Written      -O--CK   100   253   000    -    54321098765
242 Total_LBAs_Read         -O--CK   100   253   000    -    12345678901
                            ||||||_ K auto-keep
                            |||||__ C event count
                            ||||___ R error rate
                            |||____ S speed/performance
                            ||_____ O updated online
                            |______ P prefailure warning

